,title,authors
738,Weakly Supervised Action Selection Learning in Video,"Junwei Ma, Satya Krishna Gorti, Maksims Volkovs, Guangwei Yu"
739,Learning To Segment Actions From Visual and Language Instructions via Differentiable Weak Sequence Alignment,"Yuhan Shen, Lu Wang, Ehsan Elhamifar"
740,Semantic Image Matting,"Yanan Sun, Chi-Keung Tang, Yu-Wing Tai"
741,Informative and Consistent Correspondence Mining for Cross-Domain Weakly Supervised Object Detection,"Luwei Hou, Yu Zhang, Kui Fu, Jia Li"
742,Semi-Supervised Domain Adaptation Based on Dual-Level Domain Mixing for Semantic Segmentation,"Shuaijun Chen, Xu Jia, Jianzhong He, Yongjie Shi, Jianzhuang Liu"
743,Shelf-Supervised Mesh Prediction in the Wild,"Yufei Ye, Shubham Tulsiani, Abhinav Gupta"
744,Gated Spatio-Temporal Attention-Guided Video Deblurring,"Maitreya Suin, A. N. Rajagopalan"
745,Learning Multi-Scale Photo Exposure Correction,"Mahmoud Afifi, Konstantinos G. Derpanis, Bjorn Ommer, Michael S. Brown"
746,Learning Semantic Person Image Generation by Region-Adaptive Normalization,"Zhengyao Lv, Xiaoming Li, Xin Li, Fu Li, Tianwei Lin, Dongliang He, Wangmeng Zuo"
747,Rethinking Class Relations: Absolute-Relative Supervised and Unsupervised Few-Shot Learning,"Hongguang Zhang, Piotr Koniusz, Songlei Jian, Hongdong Li, Philip H. S. Torr"
748,Plan2Scene: Converting Floorplans to 3D Scenes,"Madhawa Vidanapathirana, Qirui Wu, Yasutaka Furukawa, Angel X. Chang, Manolis Savva"
749,DatasetGAN: Efficient Labeled Data Factory With Minimal Human Effort,"Yuxuan Zhang, Huan Ling, Jun Gao, Kangxue Yin, Jean-Francois Lafleche, Adela Barriuso, Antonio Torralba, Sanja Fidler"
750,SUTD-TrafficQA: A Question Answering Benchmark and an Efficient Network for Video Reasoning Over Traffic Events,"Li Xu, He Huang, Jun Liu"
751,StyleMeUp: Towards Style-Agnostic Sketch-Based Image Retrieval,"Aneeshan Sain, Ayan Kumar Bhunia, Yongxin Yang, Tao Xiang, Yi-Zhe Song"
752,Reformulating HOI Detection As Adaptive Set Prediction,"Mingfei Chen, Yue Liao, Si Liu, Zhiyuan Chen, Fei Wang, Chen Qian"
753,Strengthen Learning Tolerance for Weakly Supervised Object Localization,"Guangyu Guo, Junwei Han, Fang Wan, Dingwen Zhang"
754,Mesh Saliency: An Independent Perceptual Measure or a Derivative of Image Saliency?,"Ran Song, Wei Zhang, Yitian Zhao, Yonghuai Liu, Paul L. Rosin"
755,Passive Inter-Photon Imaging,"Atul Ingle, Trevor Seets, Mauro Buttafava, Shantanu Gupta, Alberto Tosi, Mohit Gupta, Andreas Velten"
756,Domain Consensus Clustering for Universal Domain Adaptation,"Guangrui Li, Guoliang Kang, Yi Zhu, Yunchao Wei, Yi Yang"
757,Probabilistic Embeddings for Cross-Modal Retrieval,"Sanghyuk Chun, Seong Joon Oh, Rafael Sampaio de Rezende, Yannis Kalantidis, Diane Larlus"
758,PD-GAN: Probabilistic Diverse GAN for Image Inpainting,"Hongyu Liu, Ziyu Wan, Wei Huang, Yibing Song, Xintong Han, Jing Liao"
759,CutPaste: Self-Supervised Learning for Anomaly Detection and Localization,"Chun-Liang Li, Kihyuk Sohn, Jinsung Yoon, Tomas Pfister"
760,Complementary Relation Contrastive Distillation,"Jinguo Zhu, Shixiang Tang, Dapeng Chen, Shijie Yu, Yakun Liu, Mingzhe Rong, Aijun Yang, Xiaohua Wang"
761,HDR Environment Map Estimation for Real-Time Augmented Reality,"Gowri Somanath, Daniel Kurz"
762,Self-Supervised Simultaneous Multi-Step Prediction of Road Dynamics and Cost Map,"Elmira Amirloo, Mohsen Rohani, Ershad Banijamali, Jun Luo, Pascal Poupart"
763,Stay Positive: Non-Negative Image Synthesis for Augmented Reality,"Katie Luo, Guandao Yang, Wenqi Xian, Harald Haraldsson, Bharath Hariharan, Serge Belongie"
764,Regularizing Generative Adversarial Networks Under Limited Data,"Hung-Yu Tseng, Lu Jiang, Ce Liu, Ming-Hsuan Yang, Weilong Yang"
765,Regularizing Neural Networks via Adversarial Model Perturbation,"Yaowei Zheng, Richong Zhang, Yongyi Mao"
766,Contrastive Neural Architecture Search With Neural Architecture Comparators,"Yaofo Chen, Yong Guo, Qi Chen, Minli Li, Wei Zeng, Yaowei Wang, Mingkui Tan"
767,SIPSA-Net: Shift-Invariant Pan Sharpening With Moving Object Alignment for Satellite Imagery,"Jaehyup Lee, Soomin Seo, Munchurl Kim"
768,Generalizable Pedestrian Detection: The Elephant in the Room,"Irtiza Hasan, Shengcai Liao, Jinpeng Li, Saad Ullah Akram, Ling Shao"
769,Learning Neural Representation of Camera Pose with Matrix Representation of Pose Shift via View Synthesis,"Yaxuan Zhu, Ruiqi Gao, Siyuan Huang, Song-Chun Zhu, Ying Nian Wu"
770,PML: Progressive Margin Loss for Long-Tailed Age Classification,"Zongyong Deng, Hao Liu, Yaoxing Wang, Chenyang Wang, Zekuan Yu, Xuehong Sun"
771,Single Image Depth Prediction With Wavelet Decomposition,"Michael Ramamonjisoa, Michael Firman, Jamie Watson, Vincent Lepetit, Daniyar Turmukhambetov"
772,KOALAnet: Blind Super-Resolution Using Kernel-Oriented Adaptive Local Adjustment,"Soo Ye Kim, Hyeonjun Sim, Munchurl Kim"
773,Positive Sample Propagation Along the Audio-Visual Event Line,"Jinxing Zhou, Liang Zheng, Yiran Zhong, Shijie Hao, Meng Wang"
774,Real-Time High-Resolution Background Matting,"Shanchuan Lin, Andrey Ryabtsev, Soumyadip Sengupta, Brian L. Curless, Steven M. Seitz, Ira Kemelmacher-Shlizerman"
775,Metadata Normalization,"Mandy Lu, Qingyu Zhao, Jiequan Zhang, Kilian M. Pohl, Li Fei-Fei, Juan Carlos Niebles, Ehsan Adeli"
776,Discriminative Appearance Modeling With Multi-Track Pooling for Real-Time Multi-Object Tracking,"Chanho Kim, Li Fuxin, Mazen Alotaibi, James M. Rehg"
777,Confluent Vessel Trees With Accurate Bifurcations,"Zhongwen Zhang, Dmitrii Marin, Maria Drangova, Yuri Boykov"
778,Context-Aware Biaffine Localizing Network for Temporal Sentence Grounding,"Daizong Liu, Xiaoye Qu, Jianfeng Dong, Pan Zhou, Yu Cheng, Wei Wei, Zichuan Xu, Yulai Xie"
779,Auto-Exposure Fusion for Single-Image Shadow Removal,"Lan Fu, Changqing Zhou, Qing Guo, Felix Juefei-Xu, Hongkai Yu, Wei Feng, Yang Liu, Song Wang"
780,Simpler Certified Radius Maximization by Propagating Covariances,"Xingjian Zhen, Rudrasis Chakraborty, Vikas Singh"
781,ARVo: Learning All-Range Volumetric Correspondence for Video Deblurring,"Dongxu Li, Chenchen Xu, Kaihao Zhang, Xin Yu, Yiran Zhong, Wenqi Ren, Hanna Suominen, Hongdong Li"
782,CodedStereo: Learned Phase Masks for Large Depth-of-Field Stereo,"Shiyu Tan, Yicheng Wu, Shoou-I Yu, Ashok Veeraraghavan"
783,Retinex-Inspired Unrolling With Cooperative Prior Architecture Search for Low-Light Image Enhancement,"Risheng Liu, Long Ma, Jiaao Zhang, Xin Fan, Zhongxuan Luo"
784,Towards Fast and Accurate Real-World Depth Super-Resolution: Benchmark Dataset and Baseline,"Lingzhi He, Hongguang Zhu, Feng Li, Huihui Bai, Runmin Cong, Chunjie Zhang, Chunyu Lin, Meiqin Liu, Yao Zhao"
785,DI-Fusion: Online Implicit 3D Reconstruction With Deep Priors,"Jiahui Huang, Shi-Sheng Huang, Haoxuan Song, Shi-Min Hu"
786,Graph-Based High-Order Relation Modeling for Long-Term Action Recognition,"Jiaming Zhou, Kun-Yu Lin, Haoxin Li, Wei-Shi Zheng"
787,"img2pose: Face Alignment and Detection via 6DoF, Face Pose Estimation","Vitor Albiero, Xingyu Chen, Xi Yin, Guan Pang, Tal Hassner"
788,NeuroMorph: Unsupervised Shape Interpolation and Correspondence in One Go,"Marvin Eisenberger, David Novotny, Gael Kerchenbaum, Patrick Labatut, Natalia Neverova, Daniel Cremers, Andrea Vedaldi"
789,Progressive Contour Regression for Arbitrary-Shape Scene Text Detection,"Pengwen Dai, Sanyi Zhang, Hua Zhang, Xiaochun Cao"
790,The Neural Tangent Link Between CNN Denoisers and Non-Local Filters,"Julian Tachella, Junqi Tang, Mike Davies"
791,Dynamic Slimmable Network,"Changlin Li, Guangrun Wang, Bing Wang, Xiaodan Liang, Zhihui Li, Xiaojun Chang"
792,Semi-Supervised Synthesis of High-Resolution Editable Textures for 3D Humans,"Bindita Chaudhuri, Nikolaos Sarafianos, Linda Shapiro, Tony Tung"
793,Thinking Fast and Slow: Efficient Text-to-Visual Retrieval With Transformers,"Antoine Miech, Jean-Baptiste Alayrac, Ivan Laptev, Josef Sivic, Andrew Zisserman"
794,Uncertainty Reduction for Model Adaptation in Semantic Segmentation,"Prabhu Teja S, Francois Fleuret"
795,Learning Triadic Belief Dynamics in Nonverbal Communication From Videos,"Lifeng Fan, Shuwen Qiu, Zilong Zheng, Tao Gao, Song-Chun Zhu, Yixin Zhu"
796,Adaptive Prototype Learning and Allocation for Few-Shot Segmentation,"Gen Li, Varun Jampani, Laura Sevilla-Lara, Deqing Sun, Jonghyun Kim, Joongkyu Kim"
797,Im2Vec: Synthesizing Vector Graphics Without Vector Supervision,"Pradyumna Reddy, Michael Gharbi, Michal Lukac, Niloy J. Mitra"
798,Unsupervised Part Segmentation Through Disentangling Appearance and Shape,"Shilong Liu, Lei Zhang, Xiao Yang, Hang Su, Jun Zhu"
799,Affective Processes: Stochastic Modelling of Temporal Context for Emotion and Facial Expression Recognition,"Enrique Sanchez, Mani Kumar Tellamekala, Michel Valstar, Georgios Tzimiropoulos"
800,ID-Unet: Iterative Soft and Hard Deformation for View Synthesis,"Mingyu Yin, Li Sun, Qingli Li"
801,Mask-ToF: Learning Microlens Masks for Flying Pixel Correction in Time-of-Flight Imaging,"Ilya Chugunov, Seung-Hwan Baek, Qiang Fu, Wolfgang Heidrich, Felix Heide"
802,QPP: Real-Time Quantization Parameter Prediction for Deep Neural Networks,"Vladimir Kryzhanovskiy, Gleb Balitskiy, Nikolay Kozyrskiy, Aleksandr Zuruev"
803,CReST: A Class-Rebalancing Self-Training Framework for Imbalanced Semi-Supervised Learning,"Chen Wei, Kihyuk Sohn, Clayton Mellina, Alan Yuille, Fan Yang"
804,Towards Diverse Paragraph Captioning for Untrimmed Videos,"Yuqing Song, Shizhe Chen, Qin Jin"
805,Adversarial Robustness Across Representation Spaces,"Pranjal Awasthi, George Yu, Chun-Sung Ferng, Andrew Tomkins, Da-Cheng Juan"
806,MagDR: Mask-Guided Detection and Reconstruction for Defending Deepfakes,"Zhikai Chen, Lingxi Xie, Shanmin Pang, Yong He, Bo Zhang"
807,"Lighting, Reflectance and Geometry Estimation From 360deg Panoramic Stereo","Junxuan Li, Hongdong Li, Yasuyuki Matsushita"
808,NeX: Real-Time View Synthesis With Neural Basis Expansion,"Suttisak Wizadwongsa, Pakkapon Phongthawee, Jiraphon Yenphraphai, Supasorn Suwajanakorn"
809,Beyond Bounding-Box: Convex-Hull Feature Adaptation for Oriented and Densely Packed Object Detection,"Zonghao Guo, Chang Liu, Xiaosong Zhang, Jianbin Jiao, Xiangyang Ji, Qixiang Ye"
810,Parser-Free Virtual Try-On via Distilling Appearance Flows,"Yuying Ge, Yibing Song, Ruimao Zhang, Chongjian Ge, Wei Liu, Ping Luo"
811,Rethinking BiSeNet for Real-Time Semantic Segmentation,"Mingyuan Fan, Shenqi Lai, Junshi Huang, Xiaoming Wei, Zhenhua Chai, Junfeng Luo, Xiaolin Wei"
812,Learning To Restore Hazy Video: A New Real-World Dataset and a New Method,"Xinyi Zhang, Hang Dong, Jinshan Pan, Chao Zhu, Ying Tai, Chengjie Wang, Jilin Li, Feiyue Huang, Fei Wang"
813,Towards Efficient Tensor Decomposition-Based DNN Model Compression With Optimization Framework,"Miao Yin, Yang Sui, Siyu Liao, Bo Yuan"
814,User-Guided Line Art Flat Filling With Split Filling Mechanism,"Lvmin Zhang, Chengze Li, Edgar Simo-Serra, Yi Ji, Tien-Tsin Wong, Chunping Liu"
815,DeFLOCNet: Deep Image Editing via Flexible Low-Level Controls,"Hongyu Liu, Ziyu Wan, Wei Huang, Yibing Song, Xintong Han, Jing Liao, Bin Jiang, Wei Liu"
816,Group Whitening: Balancing Learning Efficiency and Representational Capacity,"Lei Huang, Yi Zhou, Li Liu, Fan Zhu, Ling Shao"
817,Adversarial Robustness Under Long-Tailed Distribution,"Tong Wu, Ziwei Liu, Qingqiu Huang, Yu Wang, Dahua Lin"
818,Augmentation Strategies for Learning With Noisy Labels,"Kento Nishi, Yi Ding, Alex Rich, Tobias Hollerer"
819,AdaStereo: A Simple and Efficient Approach for Adaptive Stereo Matching,"Xiao Song, Guorun Yang, Xinge Zhu, Hui Zhou, Zhe Wang, Jianping Shi"
820,Point Cloud Instance Segmentation Using Probabilistic Embeddings,"Biao Zhang, Peter Wonka"
821,Large-Capacity Image Steganography Based on Invertible Neural Networks,"Shao-Ping Lu, Rong Wang, Tao Zhong, Paul L. Rosin"
822,Exploiting Edge-Oriented Reasoning for 3D Point-Based Scene Graph Analysis,"Chaoyi Zhang, Jianhui Yu, Yang Song, Weidong Cai"
823,Every Annotation Counts: Multi-Label Deep Supervision for Medical Image Segmentation,"Simon Reiss, Constantin Seibold, Alexander Freytag, Erik Rodner, Rainer Stiefelhagen"
824,FAPIS: A Few-Shot Anchor-Free Part-Based Instance Segmenter,"Khoi Nguyen, Sinisa Todorovic"
825,Gradient Forward-Propagation for Large-Scale Temporal Video Modelling,"Mateusz Malinowski, Dimitrios Vytiniotis, Grzegorz Swirszcz, Viorica Patraucean, Joao Carreira"
826,Learning a Non-Blind Deblurring Network for Night Blurry Images,"Liang Chen, Jiawei Zhang, Jinshan Pan, Songnan Lin, Faming Fang, Jimmy S. Ren"
827,Differentiable Diffusion for Dense Depth Estimation From Multi-View Images,"Numair Khan, Min H. Kim, James Tompkin"
828,Deep Compositional Metric Learning,"Wenzhao Zheng, Chengkun Wang, Jiwen Lu, Jie Zhou"
829,AIFit: Automatic 3D Human-Interpretable Feedback Models for Fitness Training,"Mihai Fieraru, Mihai Zanfir, Silviu Cristian Pirlea, Vlad Olaru, Cristian Sminchisescu"
830,Synthesizing Long-Term 3D Human Motion and Interaction in 3D Scenes,"Jiashun Wang, Huazhe Xu, Jingwei Xu, Sifei Liu, Xiaolong Wang"
831,Diverse Branch Block: Building a Convolution as an Inception-Like Unit,"Xiaohan Ding, Xiangyu Zhang, Jungong Han, Guiguang Ding"
832,Post-Hoc Uncertainty Calibration for Domain Drift Scenarios,"Christian Tomani, Sebastian Gruber, Muhammed Ebrar Erdem, Daniel Cremers, Florian Buettner"
833,LAU-Net: Latitude Adaptive Upscaling Network for Omnidirectional Image Super-Resolution,"Xin Deng, Hao Wang, Mai Xu, Yichen Guo, Yuhang Song, Li Yang"
834,CDFI: Compression-Driven Network Design for Frame Interpolation,"Tianyu Ding, Luming Liang, Zhihui Zhu, Ilya Zharkov"
835,Representative Batch Normalization With Feature Calibration,"Shang-Hua Gao, Qi Han, Duo Li, Ming-Ming Cheng, Pai Peng"
836,VarifocalNet: An IoU-Aware Dense Object Detector,"Haoyang Zhang, Ying Wang, Feras Dayoub, Niko Sunderhauf"
837,Abstract Spatial-Temporal Reasoning via Probabilistic Abduction and Execution,"Chi Zhang, Baoxiong Jia, Song-Chun Zhu, Yixin Zhu"
838,Reducing Domain Gap by Reducing Style Bias,"Hyeonseob Nam, HyunJae Lee, Jongchan Park, Wonjun Yoon, Donggeun Yoo"
839,Semantic Relation Reasoning for Shot-Stable Few-Shot Object Detection,"Chenchen Zhu, Fangyi Chen, Uzair Ahmed, Zhiqiang Shen, Marios Savvides"
840,Online Multiple Object Tracking With Cross-Task Synergy,"Song Guo, Jingya Wang, Xinchao Wang, Dacheng Tao"
841,Prior Based Human Completion,"Zibo Zhao, Wen Liu, Yanyu Xu, Xianing Chen, Weixin Luo, Lei Jin, Bohui Zhu, Tong Liu, Binqiang Zhao, Shenghua Gao"
842,FSCE: Few-Shot Object Detection via Contrastive Proposal Encoding,"Bo Sun, Banghuai Li, Shengcai Cai, Ye Yuan, Chi Zhang"
843,Learning 3D Shape Feature for Texture-Insensitive Person Re-Identification,"Jiaxing Chen, Xinyang Jiang, Fudong Wang, Jun Zhang, Feng Zheng, Xing Sun, Wei-Shi Zheng"
844,OPANAS: One-Shot Path Aggregation Network Architecture Search for Object Detection,"Tingting Liang, Yongtao Wang, Zhi Tang, Guosheng Hu, Haibin Ling"
845,Partial Person Re-Identification With Part-Part Correspondence Learning,"Tianyu He, Xu Shen, Jianqiang Huang, Zhibo Chen, Xian-Sheng Hua"
846,Transformer Tracking,"Xin Chen, Bin Yan, Jiawen Zhu, Dong Wang, Xiaoyun Yang, Huchuan Lu"
847,Structured Scene Memory for Vision-Language Navigation,"Hanqing Wang, Wenguan Wang, Wei Liang, Caiming Xiong, Jianbing Shen"
848,Progressive Stage-Wise Learning for Unsupervised Feature Representation Enhancement,"Zefan Li, Chenxi Liu, Alan Yuille, Bingbing Ni, Wenjun Zhang, Wen Gao"
849,Domain-Specific Suppression for Adaptive Object Detection,"Yu Wang, Rui Zhang, Shuo Zhang, Miao Li, Yangyang Xia, Xishan Zhang, Shaoli Liu"
850,D2IM-Net: Learning Detail Disentangled Implicit Fields From Single Images,"Manyi Li, Hao Zhang"
851,MonoRUn: Monocular 3D Object Detection by Reconstruction and Uncertainty Propagation,"Hansheng Chen, Yuyao Huang, Wei Tian, Zhong Gao, Lu Xiong"
852,Few-Shot Image Generation via Cross-Domain Correspondence,"Utkarsh Ojha, Yijun Li, Jingwan Lu, Alexei A. Efros, Yong Jae Lee, Eli Shechtman, Richard Zhang"
853,Neural Body: Implicit Neural Representations With Structured Latent Codes for Novel View Synthesis of Dynamic Humans,"Sida Peng, Yuanqing Zhang, Yinghao Xu, Qianqian Wang, Qing Shuai, Hujun Bao, Xiaowei Zhou"
854,3D Video Stabilization With Depth Estimation by CNN-Based Optimization,"Yao-Chih Lee, Kuan-Wei Tseng, Yu-Ta Chen, Chien-Cheng Chen, Chu-Song Chen, Yi-Ping Hung"
855,Predicting Human Scanpaths in Visual Question Answering,"Xianyu Chen, Ming Jiang, Qi Zhao"
856,DetectoRS: Detecting Objects With Recursive Feature Pyramid and Switchable Atrous Convolution,"Siyuan Qiao, Liang-Chieh Chen, Alan Yuille"
857,Improving Accuracy of Binary Neural Networks Using Unbalanced Activation Distribution,"Hyungjun Kim, Jihoon Park, Changhun Lee, Jae-Joon Kim"
858,Cylindrical and Asymmetrical 3D Convolution Networks for LiDAR Segmentation,"Xinge Zhu, Hui Zhou, Tai Wang, Fangzhou Hong, Yuexin Ma, Wei Li, Hongsheng Li, Dahua Lin"
859,DCT-Mask: Discrete Cosine Transform Mask Representation for Instance Segmentation,"Xing Shen, Jirui Yang, Chunbo Wei, Bing Deng, Jianqiang Huang, Xian-Sheng Hua, Xiaoliang Cheng, Kewei Liang"
860,Dynamic Domain Adaptation for Efficient Inference,"Shuang Li, JinMing Zhang, Wenxuan Ma, Chi Harold Liu, Wei Li"
861,Unsupervised Multi-Source Domain Adaptation Without Access to Source Data,"Sk Miraj Ahmed, Dripta S. Raychaudhuri, Sujoy Paul, Samet Oymak, Amit K. Roy-Chowdhury"
862,Cross Modal Focal Loss for RGBD Face Anti-Spoofing,"Anjith George, Sebastien Marcel"
863,Tangent Space Backpropagation for 3D Transformation Groups,"Zachary Teed, Jia Deng"
864,Few-Shot Classification With Feature Map Reconstruction Networks,"Davis Wertheimer, Luming Tang, Bharath Hariharan"
865,Spatio-temporal Contrastive Domain Adaptation for Action Recognition,"Xiaolin Song, Sicheng Zhao, Jingyu Yang, Huanjing Yue, Pengfei Xu, Runbo Hu, Hua Chai"
866,Exploiting Semantic Embedding and Visual Feature for Facial Action Unit Detection,"Huiyuan Yang, Lijun Yin, Yi Zhou, Jiuxiang Gu"
867,Categorical Depth Distribution Network for Monocular 3D Object Detection,"Cody Reading, Ali Harakeh, Julia Chae, Steven L. Waslander"
868,Unsupervised Learning for Robust Fitting: A Reinforcement Learning Approach,"Giang Truong, Huu Le, David Suter, Erchuan Zhang, Syed Zulqarnain Gilani"
869,Learning to Track Instances without Video Annotations,"Yang Fu, Sifei Liu, Umar Iqbal, Shalini De Mello, Humphrey Shi, Jan Kautz"
870,Representation Learning via Global Temporal Alignment and Cycle-Consistency,"Isma Hadji, Konstantinos G. Derpanis, Allan D. Jepson"
871,When Age-Invariant Face Recognition Meets Face Age Synthesis: A Multi-Task Learning Framework,"Zhizhong Huang, Junping Zhang, Hongming Shan"
872,Learning Dynamics via Graph Neural Networks for Human Pose Estimation and Tracking,"Yiding Yang, Zhou Ren, Haoxiang Li, Chunluan Zhou, Xinchao Wang, Gang Hua"
873,Smoothing the Disentangled Latent Style Space for Unsupervised Image-to-Image Translation,"Yahui Liu, Enver Sangineto, Yajing Chen, Linchao Bao, Haoxian Zhang, Nicu Sebe, Bruno Lepri, Wei Wang, Marco De Nadai"
874,Robust Instance Segmentation Through Reasoning About Multi-Object Occlusion,"Xiaoding Yuan, Adam Kortylewski, Yihong Sun, Alan Yuille"
875,Architectural Adversarial Robustness: The Case for Deep Pursuit,"George Cazenavette, Calvin Murdock, Simon Lucey"
876,Scene Essence,"Jiayan Qiu, Yiding Yang, Xinchao Wang, Dacheng Tao"
877,VDSM: Unsupervised Video Disentanglement With State-Space Modeling and Deep Mixtures of Experts,"Matthew J. Vowels, Necati Cihan Camgoz, Richard Bowden"
878,Deformed Implicit Field: Modeling 3D Shapes With Learned Dense Correspondence,"Yu Deng, Jiaolong Yang, Xin Tong"
879,Verifiability and Predictability: Interpreting Utilities of Network Architectures for Point Cloud Processing,"Wen Shen, Zhihua Wei, Shikun Huang, Binbin Zhang, Panyue Chen, Ping Zhao, Quanshi Zhang"
880,Neural Splines: Fitting 3D Surfaces With Infinitely-Wide Neural Networks,"Francis Williams, Matthew Trager, Joan Bruna, Denis Zorin"
881,Few-Shot 3D Point Cloud Semantic Segmentation,"Na Zhao, Tat-Seng Chua, Gim Hee Lee"
882,Adaptive Consistency Prior Based Deep Network for Image Denoising,"Chao Ren, Xiaohai He, Chuncheng Wang, Zhibo Zhao"
883,Topological Planning With Transformers for Vision-and-Language Navigation,"Kevin Chen, Junshen K. Chen, Jo Chuang, Marynel Vazquez, Silvio Savarese"
884,Open-Book Video Captioning With Retrieve-Copy-Generate Network,"Ziqi Zhang, Zhongang Qi, Chunfeng Yuan, Ying Shan, Bing Li, Ying Deng, Weiming Hu"
885,SDD-FIQA: Unsupervised Face Image Quality Assessment With Similarity Distribution Distance,"Fu-Zhao Ou, Xingyu Chen, Ruixin Zhang, Yuge Huang, Shaoxin Li, Jilin Li, Yong Li, Liujuan Cao, Yuan-Gen Wang"
886,Embracing Uncertainty: Decoupling and De-Bias for Robust Temporal Grounding,"Hao Zhou, Chongyang Zhang, Yan Luo, Yanjun Chen, Chuanping Hu"
887,Discrete-Continuous Action Space Policy Gradient-Based Attention for Image-Text Matching,"Shiyang Yan, Li Yu, Yuan Xie"
888,Learning Continuous Image Representation With Local Implicit Image Function,"Yinbo Chen, Sifei Liu, Xiaolong Wang"
889,Locally Aware Piecewise Transformation Fields for 3D Human Mesh Registration,"Shaofei Wang, Andreas Geiger, Siyu Tang"
890,Graph Attention Tracking,"Dongyan Guo, Yanyan Shao, Ying Cui, Zhenhua Wang, Liyan Zhang, Chunhua Shen"
891,OpenMix: Reviving Known Knowledge for Discovering Novel Visual Categories in an Open World,"Zhun Zhong, Linchao Zhu, Zhiming Luo, Shaozi Li, Yi Yang, Nicu Sebe"
892,General Instance Distillation for Object Detection,"Xing Dai, Zeren Jiang, Zhao Wu, Yiping Bao, Zhicheng Wang, Si Liu, Erjin Zhou"
893,Cross-View Regularization for Domain Adaptive Panoptic Segmentation,"Jiaxing Huang, Dayan Guan, Aoran Xiao, Shijian Lu"
894,Lesion-Aware Transformers for Diabetic Retinopathy Grading,"Rui Sun, Yihao Li, Tianzhu Zhang, Zhendong Mao, Feng Wu, Yongdong Zhang"
895,QPIC: Query-Based Pairwise Human-Object Interaction Detection With Image-Wide Contextual Information,"Masato Tamura, Hiroki Ohashi, Tomoaki Yoshinaga"
896,Home Action Genome: Cooperative Compositional Action Understanding,"Nishant Rai, Haofeng Chen, Jingwei Ji, Rishi Desai, Kazuki Kozuka, Shun Ishizaka, Ehsan Adeli, Juan Carlos Niebles"
897,Less Is More: ClipBERT for Video-and-Language Learning via Sparse Sampling,"Jie Lei, Linjie Li, Luowei Zhou, Zhe Gan, Tamara L. Berg, Mohit Bansal, Jingjing Liu"
898,Self-Supervised Learning of Depth Inference for Multi-View Stereo,"Jiayu Yang, Jose M. Alvarez, Miaomiao Liu"
899,ST3D: Self-Training for Unsupervised Domain Adaptation on 3D Object Detection,"Jihan Yang, Shaoshuai Shi, Zhe Wang, Hongsheng Li, Xiaojuan Qi"
900,Exploiting & Refining Depth Distributions With Triangulation Light Curtains,"Yaadhav Raaj, Siddharth Ancha, Robert Tamburo, David Held, Srinivasa G. Narasimhan"
901,Deeply Shape-Guided Cascade for Instance Segmentation,"Hao Ding, Siyuan Qiao, Alan Yuille, Wei Shen"
902,Fashion IQ: A New Dataset Towards Retrieving Images by Natural Language Feedback,"Hui Wu, Yupeng Gao, Xiaoxiao Guo, Ziad Al-Halah, Steven Rennie, Kristen Grauman, Rogerio Feris"
903,GeoSim: Realistic Video Simulation via Geometry-Aware Composition for Self-Driving,"Yun Chen, Frieda Rong, Shivam Duggal, Shenlong Wang, Xinchen Yan, Sivabalan Manivasagam, Shangjie Xue, Ersin Yumer, Raquel Urtasun"
904,Anchor-Constrained Viterbi for Set-Supervised Action Segmentation,"Jun Li, Sinisa Todorovic"
905,Learning Scene Structure Guidance via Cross-Task Knowledge Transfer for Single Depth Super-Resolution,"Baoli Sun, Xinchen Ye, Baopu Li, Haojie Li, Zhihui Wang, Rui Xu"
906,Model-Based 3D Hand Reconstruction via Self-Supervised Learning,"Yujin Chen, Zhigang Tu, Di Kang, Linchao Bao, Ying Zhang, Xuefei Zhe, Ruizhi Chen, Junsong Yuan"
907,Learning Goals From Failure,"Dave Epstein, Carl Vondrick"
908,Linear Semantics in Generative Adversarial Networks,"Jianjin Xu, Changxi Zheng"
909,Mesoscopic Photogrammetry With an Unstabilized Phone Camera,"Kevin C. Zhou, Colin Cooke, Jaehee Park, Ruobing Qian, Roarke Horstmeyer, Joseph A. Izatt, Sina Farsiu"
910,Panoramic Image Reflection Removal,"Yuchen Hong, Qian Zheng, Lingran Zhao, Xudong Jiang, Alex C. Kot, Boxin Shi"
911,Diverse Semantic Image Synthesis via Probability Distribution Modeling,"Zhentao Tan, Menglei Chai, Dongdong Chen, Jing Liao, Qi Chu, Bin Liu, Gang Hua, Nenghai Yu"
912,NeRF in the Wild: Neural Radiance Fields for Unconstrained Photo Collections,"Ricardo Martin-Brualla, Noha Radwan, Mehdi S. M. Sajjadi, Jonathan T. Barron, Alexey Dosovitskiy, Daniel Duckworth"
913,GrooMeD-NMS: Grouped Mathematically Differentiable NMS for Monocular 3D Object Detection,"Abhinav Kumar, Garrick Brazil, Xiaoming Liu"
914,Flow Guided Transformable Bottleneck Networks for Motion Retargeting,"Jian Ren, Menglei Chai, Oliver J. Woodford, Kyle Olszewski, Sergey Tulyakov"
915,Unsupervised Degradation Representation Learning for Blind Super-Resolution,"Longguang Wang, Yingqian Wang, Xiaoyu Dong, Qingyu Xu, Jungang Yang, Wei An, Yulan Guo"
916,Semi-Supervised Action Recognition With Temporal Contrastive Learning,"Ankit Singh, Omprakash Chakraborty, Ashutosh Varshney, Rameswar Panda, Rogerio Feris, Kate Saenko, Abir Das"
917,SG-Net: Spatial Granularity Network for One-Stage Video Instance Segmentation,"Dongfang Liu, Yiming Cui, Wenbo Tan, Yingjie Chen"
918,Semantic Segmentation With Generative Models: Semi-Supervised Learning and Strong Out-of-Domain Generalization,"Daiqing Li, Junlin Yang, Karsten Kreis, Antonio Torralba, Sanja Fidler"
919,Deep Burst Super-Resolution,"Goutam Bhat, Martin Danelljan, Luc Van Gool, Radu Timofte"
920,Clusformer: A Transformer Based Clustering Approach to Unsupervised Large-Scale Face and Visual Landmark Recognition,"Xuan-Bac Nguyen, Duc Toan Bui, Chi Nhan Duong, Tien D. Bui, Khoa Luu"
