,title,authors
370,NewtonianVAE: Proportional Control and Goal Identification From Pixels via Physical Latent Spaces,"Miguel Jaques, Michael Burke, Timothy M. Hospedales"
371,Repopulating Street Scenes,"Yifan Wang, Andrew Liu, Richard Tucker, Jiajun Wu, Brian L. Curless, Steven M. Seitz, Noah Snavely"
372,Unsupervised Object Detection With LIDAR Clues,"Hao Tian, Yuntao Chen, Jifeng Dai, Zhaoxiang Zhang, Xizhou Zhu"
373,Controlling the Rain: From Removal to Rendering,"Siqi Ni, Xueyun Cao, Tao Yue, Xuemei Hu"
374,Hybrid Message Passing With Performance-Driven Structures for Facial Action Unit Detection,"Tengfei Song, Zijun Cui, Wenming Zheng, Qiang Ji"
375,Weakly Supervised Learning of Rigid 3D Scene Flow,"Zan Gojcic, Or Litany, Andreas Wieser, Leonidas J. Guibas, Tolga Birdal"
376,InverseForm: A Loss Function for Structured Boundary-Aware Segmentation,"Shubhankar Borse, Ying Wang, Yizhe Zhang, Fatih Porikli"
377,Learning Placeholders for Open-Set Recognition,"Da-Wei Zhou, Han-Jia Ye, De-Chuan Zhan"
378,More Photos Are All You Need: Semi-Supervised Learning for Fine-Grained Sketch Based Image Retrieval,"Ayan Kumar Bhunia, Pinaki Nath Chowdhury, Aneeshan Sain, Yongxin Yang, Tao Xiang, Yi-Zhe Song"
379,Unsupervised Hyperbolic Representation Learning via Message Passing Auto-Encoders,"Jiwoong Park, Junho Cho, Hyung Jin Chang, Jin Young Choi"
380,Exploring Adversarial Fake Images on Face Manifold,"Dongze Li, Wei Wang, Hongxing Fan, Jing Dong"
381,Deep Video Matting via Spatio-Temporal Alignment and Aggregation,"Yanan Sun, Guanzhi Wang, Qiao Gu, Chi-Keung Tang, Yu-Wing Tai"
382,Scale-Aware Graph Neural Network for Few-Shot Semantic Segmentation,"Guo-Sen Xie, Jie Liu, Huan Xiong, Ling Shao"
383,Adaptive Class Suppression Loss for Long-Tail Object Detection,"Tong Wang, Yousong Zhu, Chaoyang Zhao, Wei Zeng, Jinqiao Wang, Ming Tang"
384,Crossing Cuts Polygonal Puzzles: Models and Solvers,"Peleg Harel, Ohad Ben-Shahar"
385,Network Quantization With Element-Wise Gradient Scaling,"Junghyup Lee, Dohyung Kim, Bumsub Ham"
386,Soft-IntroVAE: Analyzing and Improving the Introspective Variational Autoencoder,"Tal Daniel, Aviv Tamar"
387,Universal Spectral Adversarial Attacks for Deformable Shapes,"Arianna Rampini, Franco Pestarini, Luca Cosmo, Simone Melzi, Emanuele Rodola"
388,HybrIK: A Hybrid Analytical-Neural Inverse Kinematics Solution for 3D Human Pose and Shape Estimation,"Jiefeng Li, Chao Xu, Zhicun Chen, Siyuan Bian, Lixin Yang, Cewu Lu"
389,Human De-Occlusion: Invisible Perception and Recovery for Humans,"Qiang Zhou, Shiyin Wang, Yitong Wang, Zilong Huang, Xinggang Wang"
390,Stochastic Image-to-Video Synthesis Using cINNs,"Michael Dorkenwald, Timo Milbich, Andreas Blattmann, Robin Rombach, Konstantinos G. Derpanis, Bjorn Ommer"
391,Ego-Exo: Transferring Visual Representations From Third-Person to First-Person Videos,"Yanghao Li, Tushar Nagarajan, Bo Xiong, Kristen Grauman"
392,Jo-SRC: A Contrastive Approach for Combating Noisy Labels,"Yazhou Yao, Zeren Sun, Chuanyi Zhang, Fumin Shen, Qi Wu, Jian Zhang, Zhenmin Tang"
393,RGB-D Local Implicit Function for Depth Completion of Transparent Objects,"Luyang Zhu, Arsalan Mousavian, Yu Xiang, Hammad Mazhar, Jozef van Eenbergen, Shoubhik Debnath, Dieter Fox"
394,Fingerspelling Detection in American Sign Language,"Bowen Shi, Diane Brentari, Greg Shakhnarovich, Karen Livescu"
395,Temporal Modulation Network for Controllable Space-Time Video Super-Resolution,"Gang Xu, Jun Xu, Zhen Li, Liang Wang, Xing Sun, Ming-Ming Cheng"
396,Uncertainty-Aware Camera Pose Estimation From Points and Lines,"Alexander Vakhitov, Luis Ferraz, Antonio Agudo, Francesc Moreno-Noguer"
397,Information-Theoretic Segmentation by Inpainting Error Maximization,"Pedro Savarese, Sunnie S. Y. Kim, Michael Maire, Greg Shakhnarovich, David McAllester"
398,RefineMask: Towards High-Quality Instance Segmentation With Fine-Grained Features,"Gang Zhang, Xin Lu, Jingru Tan, Jianmin Li, Zhaoxiang Zhang, Quanquan Li, Xiaolin Hu"
399,DiNTS: Differentiable Neural Network Topology Search for 3D Medical Image Segmentation,"Yufan He, Dong Yang, Holger Roth, Can Zhao, Daguang Xu"
400,Adaptive Consistency Regularization for Semi-Supervised Transfer Learning,"Abulikemu Abuduweili, Xingjian Li, Humphrey Shi, Cheng-Zhong Xu, Dejing Dou"
401,Double Low-Rank Representation With Projection Distance Penalty for Clustering,"Zhiqiang Fu, Yao Zhao, Dongxia Chang, Xingxing Zhang, Yiming Wang"
402,FlowStep3D: Model Unrolling for Self-Supervised Scene Flow Estimation,"Yair Kittenplon, Yonina C. Eldar, Dan Raviv"
403,Invertible Image Signal Processing,"Yazhou Xing, Zian Qian, Qifeng Chen"
404,Building Reliable Explanations of Unreliable Neural Networks: Locally Smoothing Perspective of Model Interpretation,"Dohun Lim, Hyeonseok Lee, Sungchan Kim"
405,DAT: Training Deep Networks Robust To Label-Noise by Matching the Feature Distributions,"Yuntao Qu, Shasha Mo, Jianwei Niu"
406,PointGuard: Provably Robust 3D Point Cloud Classification,"Hongbin Liu, Jinyuan Jia, Neil Zhenqiang Gong"
407,Protecting Intellectual Property of Generative Adversarial Networks From Ambiguity Attacks,"Ding Sheng Ong, Chee Seng Chan, Kam Woh Ng, Lixin Fan, Qiang Yang"
408,End-to-End High Dynamic Range Camera Pipeline Optimization,"Nicolas Robidoux, Luis E. Garcia Capel, Dong-eun Seo, Avinash Sharma, Federico Ariza, Felix Heide"
409,High-Speed Image Reconstruction Through Short-Term Plasticity for Spiking Cameras,"Yajing Zheng, Lingxiao Zheng, Zhaofei Yu, Boxin Shi, Yonghong Tian, Tiejun Huang"
410,Self-Supervised 3D Mesh Reconstruction From Single Images,"Tao Hu, Liwei Wang, Xiaogang Xu, Shu Liu, Jiaya Jia"
411,Combined Depth Space Based Architecture Search for Person Re-Identification,"Hanjun Li, Gaojie Wu, Wei-Shi Zheng"
412,Restore From Restored: Video Restoration With Pseudo Clean Video,"Seunghwan Lee, Donghyeon Cho, Jiwon Kim, Tae Hyun Kim"
413,Interactive Self-Training With Mean Teachers for Semi-Supervised Object Detection,"Qize Yang, Xihan Wei, Biao Wang, Xian-Sheng Hua, Lei Zhang"
414,Vx2Text: End-to-End Learning of Video-Based Text Generation From Multimodal Inputs,"Xudong Lin, Gedas Bertasius, Jue Wang, Shih-Fu Chang, Devi Parikh, Lorenzo Torresani"
415,Coming Down to Earth: Satellite-to-Street View Synthesis for Geo-Localization,"Aysim Toker, Qunjie Zhou, Maxim Maximov, Laura Leal-Taixe"
416,Room-and-Object Aware Knowledge Reasoning for Remote Embodied Referring Expression,"Chen Gao, Jinyu Chen, Si Liu, Luting Wang, Qiong Zhang, Qi Wu"
417,HyperSeg: Patch-Wise Hypernetwork for Real-Time Semantic Segmentation,"Yuval Nirkin, Lior Wolf, Tal Hassner"
418,Partition-Guided GANs,"Mohammadreza Armandpour, Ali Sadeghian, Chunyuan Li, Mingyuan Zhou"
419,GATSBI: Generative Agent-Centric Spatio-Temporal Object Interaction,"Cheol-Hui Min, Jinseok Bae, Junho Lee, Young Min Kim"
420,pixelNeRF: Neural Radiance Fields From One or Few Images,"Alex Yu, Vickie Ye, Matthew Tancik, Angjoo Kanazawa"
421,Navigating the GAN Parameter Space for Semantic Image Editing,"Anton Cherepkov, Andrey Voynov, Artem Babenko"
422,MetaSAug: Meta Semantic Augmentation for Long-Tailed Visual Recognition,"Shuang Li, Kaixiong Gong, Chi Harold Liu, Yulin Wang, Feng Qiao, Xinjing Cheng"
423,Disentangling Label Distribution for Long-Tailed Visual Recognition,"Youngkyu Hong, Seungju Han, Kwanghee Choi, Seokjun Seo, Beomsu Kim, Buru Chang"
424,Representing Videos As Discriminative Sub-Graphs for Action Recognition,"Dong Li, Zhaofan Qiu, Yingwei Pan, Ting Yao, Houqiang Li, Tao Mei"
425,How Well Do Self-Supervised Models Transfer?,"Linus Ericsson, Henry Gouk, Timothy M. Hospedales"
426,Understanding Object Dynamics for Interactive Image-to-Video Synthesis,"Andreas Blattmann, Timo Milbich, Michael Dorkenwald, Bjorn Ommer"
427,Pi-GAN: Periodic Implicit Generative Adversarial Networks for 3D-Aware Image Synthesis,"Eric R. Chan, Marco Monteiro, Petr Kellnhofer, Jiajun Wu, Gordon Wetzstein"
428,Slimmable Compressive Autoencoders for Practical Neural Image Compression,"Fei Yang, Luis Herranz, Yongmei Cheng, Mikhail G. Mozerov"
429,Function4D: Real-Time Human Volumetric Capture From Very Sparse Consumer RGBD Sensors,"Tao Yu, Zerong Zheng, Kaiwen Guo, Pengpeng Liu, Qionghai Dai, Yebin Liu"
430,Self-Attention Based Text Knowledge Mining for Text Detection,"Qi Wan, Haoqin Ji, Linlin Shen"
431,Image De-Raining via Continual Learning,"Man Zhou, Jie Xiao, Yifan Chang, Xueyang Fu, Aiping Liu, Jinshan Pan, Zheng-Jun Zha"
432,Layer-Wise Searching for 1-Bit Detectors,"Sheng Xu, Junhe Zhao, Jinhu Lu, Baochang Zhang, Shumin Han, David Doermann"
433,Distilling Audio-Visual Knowledge by Compositional Contrastive Learning,"Yanbei Chen, Yongqin Xian, A. Sophia Koepke, Ying Shan, Zeynep Akata"
434,Unsupervised Visual Attention and Invariance for Reinforcement Learning,"Xudong Wang, Long Lian, Stella X. Yu"
435,Humble Teachers Teach Better Students for Semi-Supervised Object Detection,"Yihe Tang, Weifeng Chen, Yijun Luo, Yuting Zhang"
436,One Shot Face Swapping on Megapixels,"Yuhao Zhu, Qi Li, Jian Wang, Cheng-Zhong Xu, Zhenan Sun"
437,PAConv: Position Adaptive Convolution With Dynamic Kernel Assembling on Point Clouds,"Mutian Xu, Runyu Ding, Hengshuang Zhao, Xiaojuan Qi"
438,Background-Aware Pooling and Noise-Aware Loss for Weakly-Supervised Semantic Segmentation,"Youngmin Oh, Beomjun Kim, Bumsub Ham"
439,Human POSEitioning System (HPS): 3D Human Pose Estimation and Self-Localization in Large Scenes From Body-Mounted Sensors,"Vladimir Guzov, Aymen Mir, Torsten Sattler, Gerard Pons-Moll"
440,Learning Compositional Radiance Fields of Dynamic Human Heads,"Ziyan Wang, Timur Bagautdinov, Stephen Lombardi, Tomas Simon, Jason Saragih, Jessica Hodgins, Michael Zollhofer"
441,Structured Multi-Level Interaction Network for Video Moment Localization via Language Query,"Hao Wang, Zheng-Jun Zha, Liang Li, Dong Liu, Jiebo Luo"
442,"Not Just Compete, but Collaborate: Local Image-to-Image Translation via Cooperative Mask Prediction","Daejin Kim, Mohammad Azam Khan, Jaegul Choo"
443,DSRNA: Differentiable Search of Robust Neural Architectures,"Ramtin Hosseini, Xingyi Yang, Pengtao Xie"
444,GMOT-40: A Benchmark for Generic Multiple Object Tracking,"Hexin Bai, Wensheng Cheng, Peng Chu, Juehuan Liu, Kai Zhang, Haibin Ling"
445,Cross-Modal Collaborative Representation Learning and a Large-Scale RGBT Benchmark for Crowd Counting,"Lingbo Liu, Jiaqi Chen, Hefeng Wu, Guanbin Li, Chenglong Li, Liang Lin"
446,Mitigating Face Recognition Bias via Group Adaptive Classifier,"Sixue Gong, Xiaoming Liu, Anil K. Jain"
447,Three Birds with One Stone: Multi-Task Temporal Action Detection via Recycling Temporal Annotations,"Zhihui Li, Lina Yao"
448,Image Super-Resolution With Non-Local Sparse Attention,"Yiqun Mei, Yuchen Fan, Yuqian Zhou"
449,SCANimate: Weakly Supervised Learning of Skinned Clothed Avatar Networks,"Shunsuke Saito, Jinlong Yang, Qianli Ma, Michael J. Black"
450,On Semantic Similarity in Video Retrieval,"Michael Wray, Hazel Doughty, Dima Damen"
451,Uncertainty-Guided Model Generalization to Unseen Domains,"Fengchun Qiao, Xi Peng"
452,Noise-Resistant Deep Metric Learning With Ranking-Based Instance Selection,"Chang Liu, Han Yu, Boyang Li, Zhiqi Shen, Zhanning Gao, Peiran Ren, Xuansong Xie, Lizhen Cui, Chunyan Miao"
453,Neural Scene Flow Fields for Space-Time View Synthesis of Dynamic Scenes,"Zhengqi Li, Simon Niklaus, Noah Snavely, Oliver Wang"
454,Multimodal Contrastive Training for Visual Representation Learning,"Xin Yuan, Zhe Lin, Jason Kuen, Jianming Zhang, Yilin Wang, Michael Maire, Ajinkya Kale, Baldo Faieta"
455,Object Classification From Randomized EEG Trials,"Hamad Ahmed, Ronnie B. Wilbur, Hari M. Bharadwaj, Jeffrey Mark Siskind"
456,De-Rendering the World's Revolutionary Artefacts,"Shangzhe Wu, Ameesh Makadia, Jiajun Wu, Noah Snavely, Richard Tucker, Angjoo Kanazawa"
457,Progressively Complementary Network for Fisheye Image Rectification Using Appearance Flow,"Shangrong Yang, Chunyu Lin, Kang Liao, Chunjie Zhang, Yao Zhao"
458,Back to the Feature: Learning Robust Camera Localization From Pixels To Pose,"Paul-Edouard Sarlin, Ajaykumar Unagar, Mans Larsson, Hugo Germain, Carl Toft, Viktor Larsson, Marc Pollefeys, Vincent Lepetit, Lars Hammarstrand, Fredrik Kahl, Torsten Sattler"
459,Learning Parallel Dense Correspondence From Spatio-Temporal Descriptors for Efficient and Robust 4D Reconstruction,"Jiapeng Tang, Dan Xu, Kui Jia, Lei Zhang"
460,Multi-Modal Fusion Transformer for End-to-End Autonomous Driving,"Aditya Prakash, Kashyap Chitta, Andreas Geiger"
461,Unsupervised Disentanglement of Linear-Encoded Facial Semantics,"Yutong Zheng, Yu-Kai Huang, Ran Tao, Zhiqiang Shen, Marios Savvides"
462,Learning Position and Target Consistency for Memory-Based Video Object Segmentation,"Li Hu, Peng Zhang, Bang Zhang, Pan Pan, Yinghui Xu, Rong Jin"
463,Visual Room Rearrangement,"Luca Weihs, Matt Deitke, Aniruddha Kembhavi, Roozbeh Mottaghi"
464,Right for the Right Concept: Revising Neuro-Symbolic Concepts by Interacting With Their Explanations,"Wolfgang Stammer, Patrick Schramowski, Kristian Kersting"
465,Polygonal Point Set Tracking,"Gunhee Nam, Miran Heo, Seoung Wug Oh, Joon-Young Lee, Seon Joo Kim"
466,Tracking Pedestrian Heads in Dense Crowd,"Ramana Sundararaman, Cedric De Almeida Braga, Eric Marchand, Julien Pettre"
467,Alpha-Refine: Boosting Tracking Performance by Precise Bounding Box Estimation,"Bin Yan, Xinyu Zhang, Dong Wang, Huchuan Lu, Xiaoyun Yang"
468,Conceptual 12M: Pushing Web-Scale Image-Text Pre-Training To Recognize Long-Tail Visual Concepts,"Soravit Changpinyo, Piyush Sharma, Nan Ding, Radu Soricut"
469,Generalized Few-Shot Object Detection Without Forgetting,"Zhibo Fan, Yuchen Ma, Zeming Li, Jian Sun"
470,Truly Shift-Invariant Convolutional Neural Networks,"Anadi Chaman, Ivan Dokmanic"
471,Leveraging the Availability of Two Cameras for Illuminant Estimation,"Abdelrahman Abdelhamed, Abhijith Punnappurath, Michael S. Brown"
472,Towards Accurate 3D Human Motion Prediction From Incomplete Observations,"Qiongjie Cui, Huaijiang Sun"
473,Self-Promoted Prototype Refinement for Few-Shot Class-Incremental Learning,"Kai Zhu, Yang Cao, Wei Zhai, Jie Cheng, Zheng-Jun Zha"
474,Towards Compact CNNs via Collaborative Compression,"Yuchao Li, Shaohui Lin, Jianzhuang Liu, Qixiang Ye, Mengdi Wang, Fei Chao, Fan Yang, Jincheng Ma, Qi Tian, Rongrong Ji"
475,Separating Skills and Concepts for Novel Visual Question Answering,"Spencer Whitehead, Hui Wu, Heng Ji, Rogerio Feris, Kate Saenko"
476,Scalable Differential Privacy With Sparse Network Finetuning,"Zelun Luo, Daniel J. Wu, Ehsan Adeli, Li Fei-Fei"
477,Scene Text Retrieval via Joint Text Detection and Similarity Learning,"Hao Wang, Xiang Bai, Mingkun Yang, Shenggao Zhu, Jing Wang, Wenyu Liu"
478,LiDAR-Aug: A General Rendering-Based Augmentation Framework for 3D Object Detection,"Jin Fang, Xinxin Zuo, Dingfu Zhou, Shengze Jin, Sen Wang, Liangjun Zhang"
479,Joint Noise-Tolerant Learning and Meta Camera Shift Adaptation for Unsupervised Person Re-Identification,"Fengxiang Yang, Zhun Zhong, Zhiming Luo, Yuanzheng Cai, Yaojin Lin, Shaozi Li, Nicu Sebe"
480,Single Pair Cross-Modality Super Resolution,"Guy Shacht, Dov Danon, Sharon Fogel, Daniel Cohen-Or"
481,Target-Aware Object Discovery and Association for Unsupervised Video Multi-Object Segmentation,"Tianfei Zhou, Jianwu Li, Xueyi Li, Ling Shao"
482,"End-to-End Learning for Joint Image Demosaicing, Denoising and Super-Resolution","Wenzhu Xing, Karen Egiazarian"
483,Learning To Warp for Style Transfer,"Xiao-Chang Liu, Yong-Liang Yang, Peter Hall"
484,Enriching ImageNet With Human Similarity Judgments and Psychological Embeddings,"Brett D. Roads, Bradley C. Love"
485,What's in the Image? Explorable Decoding of Compressed Images,"Yuval Bahat, Tomer Michaeli"
486,Context Modeling in 3D Human Pose Estimation: A Unified Perspective,"Xiaoxuan Ma, Jiajun Su, Chunyu Wang, Hai Ci, Yizhou Wang"
487,Consensus Maximisation Using Influences of Monotone Boolean Functions,"Ruwan Tennakoon, David Suter, Erchuan Zhang, Tat-Jun Chin, Alireza Bab-Hadiashar"
488,Learning Cross-Modal Retrieval With Noisy Labels,"Peng Hu, Xi Peng, Hongyuan Zhu, Liangli Zhen, Jie Lin"
489,Animating Pictures With Eulerian Motion Fields,"Aleksander Holynski, Brian L. Curless, Steven M. Seitz, Richard Szeliski"
490,VaB-AL: Incorporating Class Imbalance and Difficulty With Variational Bayes for Active Learning,"Jongwon Choi, Kwang Moo Yi, Jihoon Kim, Jinho Choo, Byoungjip Kim, Jinyeop Chang, Youngjune Gwon, Hyung Jin Chang"
491,DG-Font: Deformable Generative Networks for Unsupervised Font Generation,"Yangchen Xie, Xinyuan Chen, Li Sun, Yue Lu"
492,"Deep Multi-Task Learning for Joint Localization, Perception, and Prediction","John Phillips, Julieta Martinez, Ioan Andrei Barsan, Sergio Casas, Abbas Sadat, Raquel Urtasun"
493,HDMapGen: A Hierarchical Graph Generative Model of High Definition Maps,"Lu Mi, Hang Zhao, Charlie Nash, Xiaohan Jin, Jiyang Gao, Chen Sun, Cordelia Schmid, Nir Shavit, Yuning Chai, Dragomir Anguelov"
494,Self-Generated Defocus Blur Detection via Dual Adversarial Discriminators,"Wenda Zhao, Cai Shang, Huchuan Lu"
495,View Generalization for Single Image Textured 3D Models,"Anand Bhattad, Aysegul Dundar, Guilin Liu, Andrew Tao, Bryan Catanzaro"
496,Minimally Invasive Surgery for Sparse Neural Networks in Contrastive Manner,Chong Yu
497,3D Human Action Representation Learning via Cross-View Consistency Pursuit,"Linguo Li, Minsi Wang, Bingbing Ni, Hang Wang, Jiancheng Yang, Wenjun Zhang"
498,Deep Analysis of CNN-Based Spatio-Temporal Representations for Action Recognition,"Chun-Fu Richard Chen, Rameswar Panda, Kandan Ramakrishnan, Rogerio Feris, John Cohn, Aude Oliva, Quanfu Fan"
499,Part-Aware Panoptic Segmentation,"Daan de Geus, Panagiotis Meletis, Chenyang Lu, Xiaoxiao Wen, Gijs Dubbelman"
500,Convolutional Hough Matching Networks,"Juhong Min, Minsu Cho"
501,Dynamic Class Queue for Large Scale Face Recognition in the Wild,"Bi Li, Teng Xi, Gang Zhang, Haocheng Feng, Junyu Han, Jingtuo Liu, Errui Ding, Wenyu Liu"
502,Cross-Modal Center Loss for 3D Cross-Modal Retrieval,"Longlong Jing, Elahe Vahdani, Jiaxing Tan, Yingli Tian"
503,Learned Initializations for Optimizing Coordinate-Based Neural Representations,"Matthew Tancik, Ben Mildenhall, Terrance Wang, Divi Schmidt, Pratul P. Srinivasan, Jonathan T. Barron, Ren Ng"
504,Depth-Aware Mirror Segmentation,"Haiyang Mei, Bo Dong, Wen Dong, Pieter Peers, Xin Yang, Qiang Zhang, Xiaopeng Wei"
505,"Towards Improving the Consistency, Efficiency, and Flexibility of Differentiable Neural Architecture Search","Yibo Yang, Shan You, Hongyang Li, Fei Wang, Chen Qian, Zhouchen Lin"
506,Patchwise Generative ConvNet: Training Energy-Based Models From a Single Natural Image for Internal Learning,"Zilong Zheng, Jianwen Xie, Ping Li"
507,Collaborative Spatial-Temporal Modeling for Language-Queried Video Actor Segmentation,"Tianrui Hui, Shaofei Huang, Si Liu, Zihan Ding, Guanbin Li, Wenguan Wang, Jizhong Han, Fei Wang"
508,Drafting and Revision: Laplacian Pyramid Network for Fast High-Quality Artistic Style Transfer,"Tianwei Lin, Zhuoqi Ma, Fu Li, Dongliang He, Xin Li, Errui Ding, Nannan Wang, Jie Li, Xinbo Gao"
509,Refer-It-in-RGBD: A Bottom-Up Approach for 3D Visual Grounding in RGBD Images,"Haolin Liu, Anran Lin, Xiaoguang Han, Lei Yang, Yizhou Yu, Shuguang Cui"
510,Polygonal Building Extraction by Frame Field Learning,"Nicolas Girard, Dmitriy Smirnov, Justin Solomon, Yuliya Tarabalka"
511,NeuralFusion: Online Depth Fusion in Latent Space,"Silvan Weder, Johannes L. Schonberger, Marc Pollefeys, Martin R. Oswald"
512,Towards Good Practices for Efficiently Annotating Large-Scale Image Classification Datasets,"Yuan-Hong Liao, Amlan Kar, Sanja Fidler"
513,MaX-DeepLab: End-to-End Panoptic Segmentation With Mask Transformers,"Huiyu Wang, Yukun Zhu, Hartwig Adam, Alan Yuille, Liang-Chieh Chen"
514,Denoise and Contrast for Category Agnostic Shape Completion,"Antonio Alliegro, Diego Valsesia, Giulia Fracastoro, Enrico Magli, Tatiana Tommasi"
515,Transformation Invariant Few-Shot Object Detection,"Aoxue Li, Zhenguo Li"
516,2D or not 2D? Adaptive 3D Convolution Selection for Efficient Video Recognition,"Hengduo Li, Zuxuan Wu, Abhinav Shrivastava, Larry S. Davis"
517,Temporal Query Networks for Fine-Grained Video Understanding,"Chuhan Zhang, Ankush Gupta, Andrew Zisserman"
518,UniT: Unified Knowledge Transfer for Any-Shot Object Detection and Segmentation,"Siddhesh Khandelwal, Raghav Goyal, Leonid Sigal"
519,Image Inpainting Guided by Coherence Priors of Semantics and Textures,"Liang Liao, Jing Xiao, Zheng Wang, Chia-Wen Lin, Shin'ichi Satoh"
520,Face Forensics in the Wild,"Tianfei Zhou, Wenguan Wang, Zhiyuan Liang, Jianbing Shen"
521,Riggable 3D Face Reconstruction via In-Network Optimization,"Ziqian Bai, Zhaopeng Cui, Xiaoming Liu, Ping Tan"
522,S2R-DepthNet: Learning a Generalizable Depth-Specific Structural Representation,"Xiaotian Chen, Yuwang Wang, Xuejin Chen, Wenjun Zeng"
523,FFB6D: A Full Flow Bidirectional Fusion Network for 6D Pose Estimation,"Yisheng He, Haibin Huang, Haoqiang Fan, Qifeng Chen, Jian Sun"
524,Scan2Cap: Context-Aware Dense Captioning in RGB-D Scans,"Zhenyu Chen, Ali Gholami, Matthias Niessner, Angel X. Chang"
525,NeuralHumanFVV: Real-Time Neural Volumetric Human Performance Rendering Using RGB Cameras,"Xin Suo, Yuheng Jiang, Pei Lin, Yingliang Zhang, Minye Wu, Kaiwen Guo, Lan Xu"
526,Composing Photos Like a Photographer,"Chaoyi Hong, Shuaiyuan Du, Ke Xian, Hao Lu, Zhiguo Cao, Weicai Zhong"
527,NBNet: Noise Basis Learning for Image Denoising With Subspace Projection,"Shen Cheng, Yuzhi Wang, Haibin Huang, Donghao Liu, Haoqiang Fan, Shuaicheng Liu"
528,How Transferable Are Reasoning Patterns in VQA?,"Corentin Kervadec, Theo Jaunet, Grigory Antipov, Moez Baccouche, Romain Vuillemot, Christian Wolf"
529,DyStaB: Unsupervised Object Segmentation via Dynamic-Static Bootstrapping,"Yanchao Yang, Brian Lai, Stefano Soatto"
530,Deep Texture Recognition via Exploiting Cross-Layer Statistical Self-Similarity,"Zhile Chen, Feng Li, Yuhui Quan, Yong Xu, Hui Ji"
531,Lifting 2D StyleGAN for 3D-Aware Face Generation,"Yichun Shi, Divyansh Aggarwal, Anil K. Jain"
532,MeGA-CDA: Memory Guided Attention for Category-Aware Unsupervised Domain Adaptive Object Detection,"Vibashan VS, Vikram Gupta, Poojan Oza, Vishwanath A. Sindagi, Vishal M. Patel"
533,Extreme Low-Light Environment-Driven Image Denoising Over Permanently Shadowed Lunar Regions With a Physical Noise Model,"Ben Moseley, Valentin Bickel, Ignacio G. Lopez-Francos, Loveneesh Rana"
534,Generic Perceptual Loss for Modeling Structured Output Dependencies,"Yifan Liu, Hao Chen, Yu Chen, Wei Yin, Chunhua Shen"
535,Style-Based Point Generator With Adversarial Rendering for Point Cloud Completion,"Chulin Xie, Chuxin Wang, Bo Zhang, Hao Yang, Dong Chen, Fang Wen"
536,Shape and Material Capture at Home,"Daniel Lichy, Jiaye Wu, Soumyadip Sengupta, David W. Jacobs"
537,T-vMF Similarity for Regularizing Intra-Class Feature Distribution,Takumi Kobayashi
538,Surrogate Gradient Field for Latent Space Manipulation,"Minjun Li, Yanghua Jin, Huachun Zhu"
539,ZeroScatter: Domain Transfer for Long Distance Imaging and Vision Through Scattering Media,"Zheng Shi, Ethan Tseng, Mario Bijelic, Werner Ritter, Felix Heide"
540,Defending Multimodal Fusion Models Against Single-Source Adversaries,"Karren Yang, Wan-Yi Lin, Manash Barman, Filipe Condessa, Zico Kolter"
541,Rotation Coordinate Descent for Fast Globally Optimal Rotation Averaging,"Alvaro Parra, Shin-Fang Chng, Tat-Jun Chin, Anders Eriksson, Ian Reid"
542,We Are More Than Our Joints: Predicting How 3D Bodies Move,"Yan Zhang, Michael J. Black, Siyu Tang"
543,PointFlow: Flowing Semantics Through Points for Aerial Image Segmentation,"Xiangtai Li, Hao He, Xia Li, Duo Li, Guangliang Cheng, Jianping Shi, Lubin Weng, Yunhai Tong, Zhouchen Lin"
544,Deep Stable Learning for Out-of-Distribution Generalization,"Xingxuan Zhang, Peng Cui, Renzhe Xu, Linjun Zhou, Yue He, Zheyan Shen"
545,Vectorization and Rasterization: Self-Supervised Learning for Sketch and Handwriting,"Ayan Kumar Bhunia, Pinaki Nath Chowdhury, Yongxin Yang, Timothy M. Hospedales, Tao Xiang, Yi-Zhe Song"
546,Progressive Unsupervised Learning for Visual Object Tracking,"Qiangqiang Wu, Jia Wan, Antoni B. Chan"
547,IoU Attack: Towards Temporally Coherent Black-Box Adversarial Attack for Visual Object Tracking,"Shuai Jia, Yibing Song, Chao Ma, Xiaokang Yang"
548,Deep Graph Matching Under Quadratic Constraint,"Quankai Gao, Fudong Wang, Nan Xue, Jin-Gang Yu, Gui-Song Xia"
549,FBI-Denoiser: Fast Blind Image Denoiser for Poisson-Gaussian Noise,"Jaeseok Byun, Sungmin Cha, Taesup Moon"
550,Line Segment Detection Using Transformers Without Edges,"Yifan Xu, Weijian Xu, David Cheung, Zhuowen Tu"
551,Diffusion Probabilistic Models for 3D Point Cloud Generation,"Shitong Luo, Wei Hu"
552,Dual Pixel Exploration: Simultaneous Depth Estimation and Image Restoration,"Liyuan Pan, Shah Chowdhury, Richard Hartley, Miaomiao Liu, Hongguang Zhang, Hongdong Li"
553,Guided Integrated Gradients: An Adaptive Path Method for Removing Noise,"Andrei Kapishnikov, Subhashini Venugopalan, Besim Avci, Ben Wedin, Michael Terry, Tolga Bolukbasi"
554,Spatiotemporal Registration for Event-Based Visual Odometry,"Daqi Liu, Alvaro Parra, Tat-Jun Chin"
555,Data-Free Model Extraction,"Jean-Baptiste Truong, Pratyush Maini, Robert J. Walls, Nicolas Papernot"
556,Group-aware Label Transfer for Domain Adaptive Person Re-identification,"Kecheng Zheng, Wu Liu, Lingxiao He, Tao Mei, Jiebo Luo, Zheng-Jun Zha"
557,Discover Cross-Modality Nuances for Visible-Infrared Person Re-Identification,"Qiong Wu, Pingyang Dai, Jie Chen, Chia-Wen Lin, Yongjian Wu, Feiyue Huang, Bineng Zhong, Rongrong Ji"
558,Learnable Graph Matching: Incorporating Graph Partitioning With Deep Feature Learning for Multiple Object Tracking,"Jiawei He, Zehao Huang, Naiyan Wang, Zhaoxiang Zhang"
